,Name,Image,Description,Personality Traits
0,1.  Aamir Khan ,"https://m.media-amazon.com/images/M/MV5BMjAwMjk3NDUzN15BMl5BanBnXkFtZTcwNjI4MTY0NA@@._V1_UX140_CR0,0,140,209_AL_.jpg",    Aamir is no doubt one of the most dedicated actors in this world. With his recent success in India and China markets combined he has got the title of World's Biggest Superstar. He went through rapid transformations in his body structure for his films to bring out the reality factor in his ...                ,['dedicated']
1,2.  Akshay Kumar ,"https://m.media-amazon.com/images/M/MV5BODI4NDY1NzkyM15BMl5BanBnXkFtZTgwNzM3MDM0OTE@._V1_UY209_CR13,0,140,209_AL_.jpg","    Akshay Kumar, born September 9, 1967, is an actor. He studied martial arts in Hong Kong. It was a student that suggested that he try modeling. Because of his success as model, he was offered films. Along with his good looks and excellent martial art skills, he was always the first choice to do ...                ","['actor', 'good looks']"
2,3.  Ajay Devgn ,"https://m.media-amazon.com/images/M/MV5BMTY0MDY2MDMwOV5BMl5BanBnXkFtZTgwNDE4MDM0OTE@._V1_UY209_CR6,0,140,209_AL_.jpg","    Ajay Devgn is an Indian film actor, director, and producer. He made his film debut with Phool Aur Kaante in 1991 and received a Filmfare Award for Best Male Debut for his performance in the film. He then starred in films such as Jigar (1992), Dilwale (1994), Suhaag (1994), Naajayaz (1995), Diljale ...                ","['actor', 'director', 'producer']"
3,4.  Amjad Khan ,"https://m.media-amazon.com/images/M/MV5BOWUzNjU3YTUtOGIyMi00MDk3LTk1NDMtMzY4MDZlNDFhNTFhXkEyXkFqcGdeQXVyMTExNDQ2MTI@._V1_UY209_CR73,0,140,209_AL_.jpg","    Amjad Khan was born on November 12, 1940 in Hyderabad, Hyderabad State, British India. He was an actor and director, known for Sholay (1975), Inseparable Friends (1981) and Maa Kasam (1985). He was married to Shaila Khan. He died on July 27, 1992 in Bombay, Maharashtra, India.                ","['actor', 'director', 'married']"
4,5.  Amitabh Bachchan ,"https://m.media-amazon.com/images/M/MV5BNTk1OTUxMzIzMV5BMl5BanBnXkFtZTcwMzMxMjI0Nw@@._V1_UY209_CR6,0,140,209_AL_.jpg","    Son of well known poet Harivansh Rai Bachchan and Teji Bachchan. He has a brother named Ajitabh. He completed his education from Uttar Pradesh and moved to Bombay to find work as a film star, in vain though, as film-makers preferred someone with a fairer skin, and he was not quite fair enough. But ...                ",[]
5,6.  Amol Palekar ,"https://m.media-amazon.com/images/M/MV5BNzZhNDQ1YzItNTVlOC00MmVmLTkzMjEtMDFmN2Q0MDU2YmQ3XkEyXkFqcGdeQXVyMTExNDQ2MTI@._V1_UY209_CR21,0,140,209_AL_.jpg","    Amol Palekar was born on November 24, 1944 in Bombay, Bombay Presidency, British India. He is an actor and director, known for Kairee (1999), The Village Had No Walls (1995) and Gol Maal (1979).                ","['actor', 'director']"
6,7.  Abhay Deol ,"https://m.media-amazon.com/images/M/MV5BMTU2NzkzODA3OV5BMl5BanBnXkFtZTcwMzk2MDMyOA@@._V1_UX140_CR0,0,140,209_AL_.jpg","    Abhay Deol (born in 1976, India) is an Indian film actor. He is the nephew of famous veteran actor Dharmendra and cousin of actors Sunny Deol and Bobby Deol and actress Esha Deol. After graduating from Mumbai University, Abhay headed to Los Angeles and studied Fine Arts. After completing a two year...                ","['actor', 'actress']"
7,8.  Akshaye Khanna ,"https://m.media-amazon.com/images/M/MV5BMjAxNDQyNDkxM15BMl5BanBnXkFtZTcwNTQyNTA0MQ@@._V1_UY209_CR87,0,140,209_AL_.jpg","    Akshaye Khanna was born in Mumbai in 1975. He is the middle son of Bollywood actor and politician Vinod Khanna, and the younger brother of actor Rahul Khanna.After studying in Kishore Namit Kapoor Acting Institute in Mumbai, Khanna made his acting debut in Bollywood in 1997 with the movie Himalay ...                ",['actor']
8,9.  Arshad Warsi ,"https://m.media-amazon.com/images/M/MV5BNmMwOGYwMjUtN2M5My00ODIxLWI3ZjctODM2MGI4OGQzOWM0XkEyXkFqcGdeQXVyMTExNDQ2MTI@._V1_UY209_CR6,0,140,209_AL_.jpg","    Arshad Warsi was born in Mumbai, India, and did his schooling at a boarding school, Barnes School, Deolali in Nashik district, Maharashtra. He was orphaned at the age of 14 and struggled for a living in Mumbai during his early days.Financial circumstances forced Warsi to start work as a door-to-door...                ",[]
9,10.  Anushka Shetty ,"https://m.media-amazon.com/images/M/MV5BZTkxYmU1NmUtNGE4Ni00OWNmLWE5YzktNTJiZTlmMTIyMTM5XkEyXkFqcGdeQXVyMTExNDQ2MTI@._V1_UY209_CR1,0,140,209_AL_.jpg",    Anushka Shetty is an Indian Film Actress. She was also a Yoga Instructor and has trained under yoga guru Bharat Thakur.This tall and gorgeous beauty debuted in the 2005 Telugu film Super starring Nagarjuna which was super hit at box office. Later her performance in Vikramarkudu make her noticeable....                ,"['actress', 'yoga', 'tall', 'gorgeous', 'beauty']"
10,11.  Atul Kulkarni ,"https://m.media-amazon.com/images/M/MV5BY2E1ODI1MGUtYWY1ZS00ZDdlLTg0ZDctNWU1NmJhM2UxYzU5XkEyXkFqcGdeQXVyMjkxNzQ1NDI@._V1_UY209_CR0,0,140,209_AL_.jpg","    Atul Kulkarni was born on September 10, 1965 in Karnataka, India. He is an actor, known for Rang De Basanti (2006), Hey Ram (2000) and Page 3 (2005).                ",['actor']
11,12.  Asrani ,"https://m.media-amazon.com/images/M/MV5BMjEyNDQ4MzUzNF5BMl5BanBnXkFtZTgwNjY3OTczOTE@._V1_UX140_CR0,0,140,209_AL_.jpg",    Asrani was born in a middle class Sindhi family. His father migrated to Jaipur after the Partition of India and opened a shop selling carpets. He has four sisters and three brothers: two elder and one younger. Asrani was highly uninterested in business and very weak in mathematics. He completed his...                ,[]
12,13.  Ayushmann Khurrana ,"https://m.media-amazon.com/images/M/MV5BOTk4MDY4ODAwNl5BMl5BanBnXkFtZTcwNzQ0MjY2Nw@@._V1_UY209_CR87,0,140,209_AL_.jpg","    Ayushmann Khurrana was born on 14 September 1984 in Chandigarh, India. Ayushmann started off his career as a popular radio jockey, and eventually became a VJ on MTV India and one of the most popular hosts in India. He shot to stardom with the runaway hit, 'Vicky Donor' in 2012. His effortless act ...                ",['radio jockey']
13,14.  Aruna Irani ,"https://m.media-amazon.com/images/M/MV5BYWIzYjZkZTAtNDM0MS00YjBiLWJlMjItZDY1YTJhNjMxNTExXkEyXkFqcGdeQXVyNDUzOTQ5MjY@._V1_UX140_CR0,0,140,209_AL_.jpg","    Aruna Irani made her debut in the movie Gunga Jumna (1961) at nine years old playing Azra's character. After doing several small roles in films like Jahanara (1964), Farz (1967), Upkar (1967) and Aaya Sawan Jhoomke (1969). She was paired with comedian Mehmood Ali in films like Aulad (1968), Jawab, ...                ",[]
14,15.  Annu Kapoor ,"https://m.media-amazon.com/images/M/MV5BMjE4MjAxODk1NV5BMl5BanBnXkFtZTcwODQ0MjY2Nw@@._V1_UY209_CR87,0,140,209_AL_.jpg","    Annu Kapoor made his debut in the film Mandi directed by Shyam Benegal in 1983.His career has spanned nearly 30 years including a distinctive presence in Bollywood cinema, television serials, and reality game shows. He is best remembered for hosting the singing show Antakshari, produced by ZEE TV. ...                ",['hosting']
15,16.  Ashish Vidyarthi ,"https://m.media-amazon.com/images/M/MV5BMzk5Mzc5Y2YtYjJjYy00OGIyLTg4MzctZTMxNDBiYzY2MTcxXkEyXkFqcGdeQXVyNjc0MTQwOTc@._V1_UY209_CR116,0,140,209_AL_.jpg","    Ashish Vidyarthi was born on June 19, 1962 in Tellicherry, Kerala, India. He is an actor, known for 24: India (2013), Haider (2014) and Pokiri (2006).                ",['actor']
16,17.  Adil Hussain ,"https://m.media-amazon.com/images/M/MV5BN2Q2YzA4MDMtMzVkYy00ZTMwLTgzN2EtZTc4NTRiODhkNzM3XkEyXkFqcGdeQXVyMjA4ODEzMzE@._V1_UY209_CR17,0,140,209_AL_.jpg","    Adil Hussain is known for his critically acclaimed performances in award winning films such as Ang Lee's Oscar winning Life of Pi, Subhashish Bhutiani's Hotel Salvation/Mukti Bhavan, Iram Haq's What Will People Say, Danis Tanovic's Tigers, Mira Nair's The Reluctant Fundamentalist, Pan Nalin's Angry...                ",[]
17,18.  Anupam Kher ,"https://m.media-amazon.com/images/M/MV5BMjMyMjc1OTgzNF5BMl5BanBnXkFtZTgwMDY1NDMzOTE@._V1_UY209_CR3,0,140,209_AL_.jpg","    Anupam Kher was born on March 7, 1955 in Shimla, Himachal Pradesh, India. He is an actor and producer, known for Silver Linings Playbook (2012), A Wednesday (2008) and M.S. Dhoni: The Untold Story (2016).                ","['actor', 'producer']"
18,19.  Anil Kapoor ,"https://m.media-amazon.com/images/M/MV5BMjUyMWE5MjUtMDlkMC00ODc0LThkOTgtNjZhNDgyMTU5ZDhlXkEyXkFqcGdeQXVyMTExNDQ2MTI@._V1_UX140_CR0,0,140,209_AL_.jpg","    Living in a Chawl in Tilak Nagar, Punjabi-speaking Anil was born in 1959 to Surinder and Nirmal aka Suchitra Kapoor. He has an elder brother, Boney, a sister, Reena, and a younger brother, Sanjay. His dad used to be Shammi Kapoor's Secretary.A loner, without many friends, he studied in the nearby ...                ",['loner']
19,20.  Amrish Puri ,"https://m.media-amazon.com/images/M/MV5BYWRlMTk2NWYtYjhjNy00NmRjLTg4NWMtMmM2YjJlN2YwNWE4XkEyXkFqcGdeQXVyMTExNDQ2MTI@._V1_UY209_CR8,0,140,209_AL_.jpg","    Believe it or not, Amrish Puri wanted to become a Bollywood movie hero but failed a screen test in 1954. And what a failure it was! Mr. Puri went on to become one of the most renowned and credible villains in the history of Indian cinema. His most memorable and often quoted role is the character of...                ",['memorable']
20,21.  Amole Gupte ,"https://m.media-amazon.com/images/M/MV5BZmNhMWQyOGYtYmZkMy00ZjdjLWE4N2QtYjc0NzEyZjViZWQzXkEyXkFqcGdeQXVyMTExNDQ2MTI@._V1_UY209_CR11,0,140,209_AL_.jpg","    Amole Gupte is an Indian screenwriter, actor, and director, known for his work on Bollywood films like Taare Zameen Par (Like Stars on Earth), Stanley ka dabba, Kaminey and others. He is also an actor in Bheja Fry 2 (2011), stanley Ka Dabba (2011),Urumi (2011) Phas gaye re obama (2010) and Kaminey.                ","['screenwriter', 'actor', 'director', 'known for his work']"
21,22.  Boman Irani ,"https://m.media-amazon.com/images/M/MV5BNTc4ZjFlMjUtODU3MS00M2JhLTlkMzEtMmIyODFiMjAwZmJhXkEyXkFqcGdeQXVyNTE0MDc0NTM@._V1_UY209_CR62,0,140,209_AL_.jpg","    Boman Irani was born on December 2, 1959 in Bombay, State of Bombay, India. He is an actor, known for 3 Idiots (2009), Munna Bhai M.B.B.S. (2003) and Don 2 (2011). He has been married to Zenobia since January 28, 1985. They have two children.                ","['actor', 'married']"
22,23.  Balraj Sahni ,"https://m.media-amazon.com/images/M/MV5BZDgwMGMzMWUtMmQ1Yi00NjM0LTlkMDgtMTk5MmFkMWJhNDY1XkEyXkFqcGdeQXVyMTExNDQ2MTI@._V1_UY209_CR10,0,140,209_AL_.jpg","    Balraj Sahni was born on May 1, 1913 in Rawalpindi, Punjab, British India. He was an actor, known for Baazi (1951), Kabuliwala (1961) and Bhabhi (1957). He was married to Santosh Chandhok and Damayanti Sahni. He died on April 13, 1973 in Bombay, Maharashtra, India.                ","['actor', 'married']"
23,24.  Binnu Dhillon ,https://m.media-amazon.com/images/G/01/imdb/images/nopicture/medium/name-2135195744._CB466677935_.png,"    Binnu Dhillon is an actor and producer, known for Dev.D (2009), Vadhayiyaan Ji Vadhayiyaan (2018) and Chhevan Dariya (The Sixth River) (2010).                ","['actor', 'producer']"
24,25.  Bharat Bhushan ,"https://m.media-amazon.com/images/M/MV5BODIwNGY2OGItN2I4Ny00Y2ExLWEzZmQtMTI0M2IxMWQxYTU5XkEyXkFqcGdeQXVyNDUzOTQ5MjY@._V1_UY209_CR2,0,140,209_AL_.jpg","    Bharat Bhushan was born on June 14, 1920 in Meerut, United Provinces of Agra and Oudh, British India. He was an actor, known for Gateway of India (1957), Mirza Ghalib (1954) and Shri Chaitanya Mahaprabhu (1954). He died on January 27, 1992 in Bombay, Maharashtra, India.                ",['actor']
25,26.  Chiranjeevi ,"https://m.media-amazon.com/images/M/MV5BOGQ4MTc3MWYtNmUxNi00Nzk3LWFjMDItM2Y1NmVmMDEyNWIxXkEyXkFqcGdeQXVyMTExNDQ2MTI@._V1_UY209_CR3,0,140,209_AL_.jpg","    This Telugu Star was a student at the Madras Film Institute and an amateur stage actor. His first public performance was in the Republic Day parade ballet of Andra Pradesh on 26 January, 1976. His film debut was Punadhirallu (1978). His brother-in-law is producer Allu Aravind. His success started ...                ","['actor', 'producer']"
26,27.  Chunky Pandey ,"https://m.media-amazon.com/images/M/MV5BMTk5NjI3MTEwNF5BMl5BanBnXkFtZTgwMzU2MTMzOTE@._V1_UX140_CR0,0,140,209_AL_.jpg","    Chunky Pandey was born in Bombay, India on September 26, 1962 in a non-film household.Chunky's real name is Suyash Sharad Pandey, but is also known as Chandrakant Pandey. He shot into fame with a secondary role in 'Tezaab' which had Anil Kapoor and Madhuri Dixit in the lead roles. He continued to ...                ",[]
27,28.  Danny Denzongpa ,"https://m.media-amazon.com/images/M/MV5BMzI4Njg3OTcyNF5BMl5BanBnXkFtZTcwNzQzMTYxOA@@._V1_UY209_CR11,0,140,209_AL_.jpg","    Danny, who married Gawa Denzongpa, a Sikkimese princess and niece of the last chogyal from her hometown of Gangtok, currently resides in Juhu in Mumbai. He likes to listen to Nepali folk music especially Nepali flutes. In recent times he has become more selective as to the roles he plays. He does ...                ",['married']
28,29.  Darsheel Safary ,"https://m.media-amazon.com/images/M/MV5BMjYyYzViMmYtMjU4Yi00NGM3LWFjZTEtZmFkOGFmOTllY2I2XkEyXkFqcGdeQXVyMTExNDQ2MTI@._V1_UY209_CR4,0,140,209_AL_.jpg","    Born in the same city and on the same month as his family friend Aamir Khan, Darsheel Safary (born March 9, 1997 in Mumbai, India) is an Indian child movie actor primarily working on starring in Hindi Bollywood films. He is best known for his acclaimed portrayal of a dyslexic child in the 2007 film...                ",['actor']
29,30.  Deepak Tijori ,"https://m.media-amazon.com/images/M/MV5BNmIwYzhiNjUtYmY3NS00YjdhLTlkM2UtZDJhZDJiNDkzNDI5XkEyXkFqcGdeQXVyNDY2Nzg2NQ@@._V1_UY209_CR34,0,140,209_AL_.jpg","    Deepak Tijori was born on August 28, 1961 in Bombay, Maharashtra, India. He is an actor and director, known for Fox (2009), Do Lafzon Ki Kahani (2016) and Tipsy (2020).                ","['actor', 'director']"
30,31.  Dharmendra ,"https://m.media-amazon.com/images/M/MV5BMTk0ODU5NjAzMl5BMl5BanBnXkFtZTcwNDYyOTM5NA@@._V1_UY209_CR87,0,140,209_AL_.jpg",    Dharmendra is one of the biggest stars of Indian cinema. Dharmendra Deol played the romantic hero in woman centric films from 1960-1968 and became romantic hero from 1968-69 and played the role of action hero from 1971-1997. Dharmendra has appeared in 306 films.He is known as 'Garam' Dharam in ...                ,[]
31,32.  Deepika Padukone ,"https://m.media-amazon.com/images/M/MV5BNGFlYzAyYjgtNzRjNS00NmE4LTliOGYtYzBkYzU5MzRhMDM0XkEyXkFqcGdeQXVyMTExNDQ2MTI@._V1_UX140_CR0,0,140,209_AL_.jpg","    Deepika Padukone, born 5 January 1986 in Copenhagen, Denmark, is an Indian model & Actress. She is the daughter of former badminton Champion Prakash Padukone. Her mother tongue is Konkani. Deepika has a younger sister named Anisha.She has been modeling appearances in print and television advertising...                ",['actress']
32,33.  Dimple Kapadia ,"https://m.media-amazon.com/images/M/MV5BNTc4MTE1NDU5MF5BMl5BanBnXkFtZTcwNDI2MTcxOA@@._V1_UY209_CR81,0,140,209_AL_.jpg","    Born in a Gujerati-speaking family on June 8, 1957, daughter to businessman, Chunnibhai and Betty, Dimple has a younger sister, Simple, who was born on 15 August 1958.She was discovered by Raj Kapoor, who signed her up opposite his son, Rishi, in the 1973 hit 'Bobby'. The film made Rishi and her ...                ",[]
33,34.  Dev Anand ,"https://m.media-amazon.com/images/M/MV5BMTk5MDI0OTQzOF5BMl5BanBnXkFtZTcwMTgwMzEzMQ@@._V1_UY209_CR69,0,140,209_AL_.jpg","    After having played the Lead Actor for more than five decades in over 110 motion pictures, Dev Anand continues to bestride Indian Cinema today. He has given a new dimension to that magical state known as Stardom. And for his exemplary work he was awarded the Padma Bhushan in 2001 by the President ...                ",['actor']
34,35.  Deepti Naval ,"https://m.media-amazon.com/images/M/MV5BYjhjNWM1MmUtM2M3My00MWZmLWE5NDYtNTI5YTM3MWQwNGVhXkEyXkFqcGdeQXVyNDUzOTQ5MjY@._V1_UX140_CR0,0,140,209_AL_.jpg","    Deepti Naval is an Indian film actor, director, writer, painter and photographer. A multi-faceted personality, her major contribution has been in the area of art cinema, winning critical acclaim for her sensitive and close to life characters that emphasized the changing role of women in India. The ...                ","['actor', 'director', 'writer', 'painter', 'photographer', 'sensitive']"
35,36.  Dilip Kumar ,"https://m.media-amazon.com/images/M/MV5BMzg0NTM0MjYxN15BMl5BanBnXkFtZTcwMzY1NTAzMQ@@._V1_UY209_CR68,0,140,209_AL_.jpg","    Dilip Kumar is considered to be one of the greatest actors of Indian cinema. Starting his career in 1944, he has starred in some of the biggest commercially successful films in the period 1949-1961. . He was the first actor to receive a Filmfare Best Actor Award and holds the record for most number...                ","['successful', 'actor']"
36,37.  Farooq Shaikh ,"https://m.media-amazon.com/images/M/MV5BNzY3ODZmNDctZDA0ZC00NGNmLTgzZmItM2JhMTI4MzM3NTU2XkEyXkFqcGdeQXVyMTExNDQ2MTI@._V1_UY209_CR0,0,140,209_AL_.jpg","    Farooq Sheikh was an Indian actor, philanthropist and a television presenter. He was known for his work in Hindi films from 1977 to 1989. He returned to acting in films in 2008. His major contribution was in Parallel Cinema or the New Indian Cinema. He's acted in serials and shows on television and...                ","['actor', 'philanthropist', 'known for his work']"
37,38.  Farhan Akhtar ,"https://m.media-amazon.com/images/M/MV5BMjA4MjYwNzAzM15BMl5BanBnXkFtZTcwMzUyMTUxNw@@._V1_UX140_CR0,0,140,209_AL_.jpg","    An accomplished and award-winning producer-director-writer-actor-singer, Farhan Akhtar is the ultimate Bollywood multi-hyphenate. Born in 1974 to prolific Indian film writer and poet, Javed Akhtar and writer-director, Honey Irani , Farhan was raised in an environment where creativity and ...                ","['producer', 'director', 'writer', 'actor', 'singer']"
38,39.  Feroz Khan ,"https://m.media-amazon.com/images/M/MV5BN2NjODM2NDItYTU0Ni00MzJmLWJkZTYtMjQ3ZDZjZmNjY2NhXkEyXkFqcGdeQXVyMTExNDQ2MTI@._V1_UY209_CR8,0,140,209_AL_.jpg","    Firoz was born in Bangalore on September 25, 1939 to a Pathan father, Sadiq, and an Iranian mother, Fatima. He has three brothers, Abbas alias Sanjay, Akbar, and Sameer. Both Sanjay and Akbar are actors within their own rights, while Sameer is a film-maker and assists in their Golden Palms Spa ...                ",[]
39,40.  Farida Jalal ,"https://m.media-amazon.com/images/M/MV5BZGE2OTUzZDEtZWQ2Ny00YTQ0LWEyYmItYmRiYjMxNTFiYzYwXkEyXkFqcGdeQXVyNDUzOTQ5MjY@._V1_UX140_CR0,0,140,209_AL_.jpg","    Farida Jalal was discovered by Filmfare's United Producers' Talent Hunt in the 1960s. She starred in her first movie as a teenager, in the Rajshri Productions' ""TAQDEER' in 1967. Thereafter she has starred in more than 200 movies as a character actress mainly, but also as lead actor in some. She is...                ","['actress', 'actor']"
40,41.  Guru Dutt ,"https://m.media-amazon.com/images/M/MV5BMjA0Mzg2NjEwN15BMl5BanBnXkFtZTgwODQ1NDQzNzE@._V1_UY209_CR69,0,140,209_AL_.jpg","    Considered to be a man ahead of his time, Guru Dutt was one of the greatest icons of commercial Indian cinema. Although he made less than fifty films, they are believed to be the best to come from Bollywood's Golden Age, known both for their ability to reach out to the common man and for their ...                ",[]
41,42.  Govinda ,"https://m.media-amazon.com/images/M/MV5BNzEwNDgwMTk3Nl5BMl5BanBnXkFtZTgwNjMwOTU4MDI@._V1_UY209_CR14,0,140,209_AL_.jpg","    Govinda was born on December 21, 1963. Govinda has acted in over 120 films since his debut in 1986. Govinda is best-known for his comedy related roles; his powerful contribution in dancing in bollywood is inevitable. He is one of the most successful actors and is definitely the best dancer in ...                ","['comedy', 'powerful', 'successful']"
42,43.  Gulshan Grover ,"https://m.media-amazon.com/images/M/MV5BM2FmZGY4NDctMzczOC00MTg3LWExZDUtYWU5NTNkMTA4YzZhXkEyXkFqcGdeQXVyODI0MDE3OQ@@._V1_UX140_CR0,0,140,209_AL_.jpg","    Gulshan Grover was born, raised and educated in Delhi, India. After receiving his master's degree in Commerce from Shri Ram College of Commerce, he decided to pursue his passion and made a lifelong commitment to entertainment industry. He honed his acting skills in theatre, and after many stage ...                ",[]
43,44.  Gurpreet Ghuggi ,"https://m.media-amazon.com/images/M/MV5BODJhZWQ3NGEtZDFmYS00YTc3LTllMzctZGFlM2U0NjliYTczXkEyXkFqcGdeQXVyMTExNDQ2MTI@._V1_UY209_CR6,0,140,209_AL_.jpg","    Gurpreet Ghuggi was born as Gurpreet Singh. He is known for his work on Race (2008), Singh Is King (2008) and Nalaik (2005). He is married to Kuljeet Kaur. They have two children.                ","['known for his work', 'married']"
44,45.  Girish Karnad ,"https://m.media-amazon.com/images/M/MV5BMTkyNDk3MjEzN15BMl5BanBnXkFtZTYwOTQyODEz._V1_UY209_CR16,0,140,209_AL_.jpg","    Girish Karnad was born on 19th May 1938 in Matheran, Maharashtra. He is acclaimed for his contemporary playwrights in Kannada. He is also an actor, director and screen writer. He was conferred Padma Shri and Padma Bhushan by the Government of India and won four Filmfare Awards where three are ...                ","['actor', 'director', 'writer']"
45,46.  Hrithik Roshan ,"https://m.media-amazon.com/images/M/MV5BZjYwYjE4YjQtMTFmMi00NTlhLThjZjUtZTIyMTczMGU2ZDE5XkEyXkFqcGdeQXVyNzM2NzM0NDU@._V1_UX140_CR0,0,140,209_AL_.jpg","    Hrithik Roshan is an Indian actor, born on 10th January 1974, well known globally for his versatile roles, unmatchable dancing skills and attractive looks.After having appeared in films as a child actor in the 1980s, Roshan made his film debut in a leading role in Kaho Naa... Pyaar Hai (2000) for ...                ",['actor']
46,47.  Huma Qureshi ,"https://m.media-amazon.com/images/M/MV5BMTEwMTkyMDY3OTheQTJeQWpwZ15BbWU4MDE1MjEyMzkx._V1_UX140_CR0,0,140,209_AL_.jpg","    Huma Qureshi born and raised in Delhi. Her father is a famous restaurant owner called Saleem's a chain of some 10 restaurants in Delhi. Her brother, Saqib Saleem is an actor and acted in Mujhse Fraaandship Karoge. In year 2011 an announcement was made that Huma would make her Bollywood debut in a ...                ",['actor']
47,48.  Inaamulhaq ,"https://m.media-amazon.com/images/M/MV5BNTlkNmU1N2YtZGI2OC00YjkwLWIxM2MtNTZkMmJkYTQ4YWE1XkEyXkFqcGdeQXVyMjQwMDg0Ng@@._V1_UY209_CR10,0,140,209_AL_.jpg","    An alumnus of National School of Drama, Inaamulhaq was born on Nov 14, 1979 in Saharanpur-Uttar Pradesh. He first appeared on stage at the age of twelve. Later, he joined the 'Indian People's Theatre Association' and acted in numerous plays as a lead.In Mumbai he started his career as a writer for ...                ",['writer']
48,49.  Irrfan Khan ,"https://m.media-amazon.com/images/M/MV5BNDg3NDgxNzY4NF5BMl5BanBnXkFtZTcwODMxODQzMg@@._V1_UY209_CR8,0,140,209_AL_.jpg","    Born Sahabzade Irfan Ali Khan, in Jaipur, Rajasthan (NW India) January 7, 1967 to a Pashto speaking Muslim family. Khan's mother, Begum Khan, was from the Tonk Hakim family and his father, Jagirdar Khan, from the Khajuriya village near the Tonk district, ran a tire business.The Khan family name ...                ",[]
49,50.  Jackie Shroff ,"https://m.media-amazon.com/images/M/MV5BYzczOGViODMtMWY1Yi00ZTAwLTkzZjItYzlmMzU0NmM5YjBmXkEyXkFqcGdeQXVyMjYwMDk5NjE@._V1_UY209_CR16,0,140,209_AL_.jpg","    Jaikishen was born in the Gujarati-speaking Shroff family on February 1, 1957. His dad's name is Kakubhai, his brother's is Hemant, and they live in Bandra, Bombay in a bungalow named 'Le Pepeyon"".A vegetarian, Jaikishen made his Bollywood debut in a bit-role as a villain in the hit Heera Panna (...                ",[]
50,51.  Jimmy Sheirgill ,"https://m.media-amazon.com/images/M/MV5BMjM2MTc1NTk5OF5BMl5BanBnXkFtZTgwOTI4NDczMDE@._V1_UY209_CR86,0,140,209_AL_.jpg","    Shergill was born in a Sikh family in Gorakhpur, Uttar Pradesh. He moved to Punjab, the place of his ancestors, in 1985 where he studied in Yadavindra Public School, Patiala and Bikram College Patiala. He learnt acting from Sri Harpal Singh, and then moved to Mumbai to work in the entertainment ...                ",[]
51,52.  Jeetendra ,"https://m.media-amazon.com/images/M/MV5BYThkMTY3NDktMDBiNy00NWFhLWIyOWEtNGRkNDRiMGJjMjZiXkEyXkFqcGdeQXVyMTExNDQ2MTI@._V1_UY209_CR5,0,140,209_AL_.jpg","    Ravi Kapoor was born in a business family that dealt with imitation Jewelery and used to live in a chawl. While supplying jewelry to V. Shantaram, he was cast as Sandhya's double in the 1959 movie 'Navrang'.His first break as a Bollywood leading man came in 'Geet Gaya Patharon Ne'. Although Ravi ...                ",[]
52,53.  Jaspal Bhatti ,"https://m.media-amazon.com/images/M/MV5BZGQzZDgxNGMtZTdjYy00NzI3LThlOGItNjdmOTc5ZjQwYjcwXkEyXkFqcGdeQXVyNDAzNDk0MTQ@._V1_UY209_CR12,0,140,209_AL_.jpg","Jaspal Bhatti, the most popular social satirist in India, graduated from Punjab Engineering College, Chandigarh in North India, as an electrical engineer. He was famous for his street plays like his My Nonsense Club during his college days. Most of these plays were spoof ridiculing the corruption ...                ",[]
53,54.  Johnny Lever ,"https://m.media-amazon.com/images/M/MV5BMjMyMTQzMjk1MV5BMl5BanBnXkFtZTgwMDg5MTMzOTE@._V1_UX140_CR0,0,140,209_AL_.jpg","    Johnny Lever, born in Andhra Pradesh and was brought up in Mumbai's King's Circle area (Dharavi). His mother tongue is Telugu. Johnny studied in Andhra Telugu School till the seventh grade but couldn't study further because of financial problems in his family, after which he decided to leave school...                ",[]
